product Discrption; product Price; product Price Fraction
Zip-up Striped Long Sleeves Jumpsuit for Boys;114;00;
Adjustable Washable and Reusable Cloth Dipaers Fitted for Baby Girls and Baby Boys-BP030PU;49;99;
Boat-Print Long Sleeves Striped Bodysuit Set for Boys;125;00;
Elephant Embroidery Snap Closure Bodysuit for Kids - White, 12 Months;31;00;
Mustache-Pattern and Striped Bodysuit Set for Boys - 2 Pieces;162;00;
botanical fibers baby bodysuit for boys Navy-0-3Month;167;00;
Cotton Striped Short-Sleeves T-shirt with Frog Stitched Sleeveless Romper Clothing Set for Boys 2 Pieces;126;00;
Wooly Heroes Burp Cloths Set - Ultra Absorbent Jersey Cotton - Large & Soft Burping Cloths - Gender Neutral Clothes Design for Baby Girl & Boy - 3-Pack;99;00;
Set of 6 units Bodysuits Multicolor;140;00;
Fashion Baby Infant First Non Toxic Fabric Soft CLOTH BOOK Squeak Crinkle Colorful Toddler Rustling Sound Activity Learning Toys - 2724636482624;80;00;
Round-Neck Baby-Print Sleeveless Bodysuit for Boys;24;00;
fur baby bodysuit embroidered strawberry for girls pink3-6Month;204;00;
Derby Under Shirt For Men;34;00;
Round-Neck Dog-Print Sleeveless Bodysuit for Boys;24;00;
botanical fibers baby bodysuit & hat printed Giraffe for boys navy-6-12Month;176;00;
Cotton Printed Wrap-Front Banded Trim Bodysuit Romper for Girls;69;00;
Basic Snap Closure Bodysuit for Kids - White, 18 Months;27;00;
Lumex Baby Bib - Multi Color;14;00;
Adjustable Washable and Reusable Cloth Dipaers Fitted for Baby Girls and Baby Boys-BP030BU;52;99;
botanical fibers baby bodysuit & hat printed I love mummy for girls simon-6-12Month;208;00;
Baby Clothes & Shoes For Unisex;100;00;
Leakproof Baby Cloth Diaper Washable adjustable;53;99;
4 Pcs Foldable Underwear Drawer Organizer Drawer Divider Storage Boxes for Bra Sock Baby Clothes Belts;125;00;
Fashion Baby Infant First Non Toxic Fabric Soft CLOTH BOOK Squeak Crinkle Colorful Toddler Rustling Sound Activity Learning Toys - 2724636483171;66;00;
Lumex Long Sleeves Baby Bib - Multi Color;49;00;
Adjustable Washable and Reusable Cloth Dipaers Fitted for Baby Girls and Baby Boys-BP030YE - 2724343143702;50;00;
CANPOL BABIES Dummy Chain Baby Toddler Baby Clothes Dummy;63;00;
Set of 6 units Baby Pants Multicolour;105;00;
Folding washing machine, mini washing machine, ultrasound washing machine, camping lodge for travel, lingerie, socks, baby clothes, sterilization;529;95;
Letter-Print Glitter-Detail Spaghetti Straps Bodysuit with Hat for Girls;61;00;
Fur baby bodysuit for girls printed flowers pink-6-12Month;253;00;
Comfort Concentrated Fabric Softener Baby, 750ml;119;00;
Mix & Max Printed Baby Burp Cloth - Multi Color;32;00;
Baby Cadeau Cotton Velvet Snap Closure Two Tone Stitched Squirrel Long Sleeves Jumpsuit for Kids - Off White & Blue, 0 - 3 Months;168;25;
1231-p winter quilted cotton pajama set for baby-boys with hood;205;00;
Mix & Max Butterfly Printed Baby Burp Cloth - Green;32;00;
Lumex Apple Shaped Bib with Drawstring for Kids;12;00;
Plain Front Snap Closure Elbow Sleeves T-shirt with Camouflage Vest and Denim Pants Set for Boys;202;00;
Turtle Print Snap Closures Contrast Trims Sleeveless Crew Neck Kids Romper - Green, 18 Months;32;00;
botanical fibers baby bodysuit & hat printed zoo for Girls grey -0-3Month;159;00;
Elsayaad Cotton Front Stitch Detail Cami Bodysuit for Kids - White, Pack of 2, 0-3 Months;65;00;
Stitched Detail Long Sleeves T-Shirt with Pants & Snap Closure Jacket for Boys - Multi Color, 0-3 months;172;00;
Explosive pet clothes autumn and winter thick cotton clothes USA air force uniforms Siamese four-legged clothes dog clothes;250;00;
Cat-Print Long Sleeves Top with Plaid Pants Pajama Set for Girls, 2 Pieces 3-6 Months;163;00;
Adjustable Washable and Reusable Cloth Dipaers Fitted for Baby Girls and Baby Boys-BP030RE - 2724343143627;65;00;
